Issue ID,Area ID,Title,Development Status,Audit Runs,Proposal Quality Score,Audit Status,Last Audit Type,Last Audit Date,Score Basis,Next Audit Need,Audit Rubric Version,Rebaseline Status,Rebaseline Notes,Adoption Friction Score,Adoption Friction Band,Adoption Friction Notes,Required Electoral Environment,Pathway Viability,Development Priority,Pathway Adjustment,Enactment Pathway Notes
PAR-002,A-05,Obstruction or witness inducement,Candidate,1,0,Pending development; no proposal-quality score assigned,Initial framework and inventory audit,2026-06-24,Issue is identified in inventory but has not yet been developed into a basic proposal framework; no proposal-quality score is assigned until development begins.,"Apply issue-admission test and decide whether to develop, merge, or retain as research inventory.",2026-06-27.1,current-fixed-status,"Fixed zero-status score is current while the issue remains candidate, retired, merged, pending controlling finding, or otherwise undeveloped.",N/A,N/A,Not scored while issue has fixed zero-status or is not developed.,N/A,N/A,N/A,N/A,Not assessed while issue has fixed zero-status or is not developed.
PAR-003,A-05,"Sale, brokerage, or monetization of pardons",Candidate,1,0,Pending development; no proposal-quality score assigned,Initial framework and inventory audit,2026-06-24,Issue is identified in inventory but has not yet been developed into a basic proposal framework; no proposal-quality score is assigned until development begins.,"Apply issue-admission test and decide whether to develop, merge, or retain as research inventory.",2026-06-27.1,current-fixed-status,"Fixed zero-status score is current while the issue remains candidate, retired, merged, pending controlling finding, or otherwise undeveloped.",N/A,N/A,Not scored while issue has fixed zero-status or is not developed.,N/A,N/A,N/A,N/A,Not assessed while issue has fixed zero-status or is not developed.
PAR-004,A-05,Pardons benefiting the president or presidential interests,Candidate,1,0,Pending development; no proposal-quality score assigned,Initial framework and inventory audit,2026-06-24,Issue is identified in inventory but has not yet been developed into a basic proposal framework; no proposal-quality score is assigned until development begins.,"Apply issue-admission test and decide whether to develop, merge, or retain as research inventory.",2026-06-27.1,current-fixed-status,"Fixed zero-status score is current while the issue remains candidate, retired, merged, pending controlling finding, or otherwise undeveloped.",N/A,N/A,Not scored while issue has fixed zero-status or is not developed.,N/A,N/A,N/A,N/A,Not assessed while issue has fixed zero-status or is not developed.
PAR-005,A-05,Self-pardon uncertainty,Candidate,1,0,Pending development; no proposal-quality score assigned,Initial framework and inventory audit,2026-06-24,Issue is identified in inventory but has not yet been developed into a basic proposal framework; no proposal-quality score is assigned until development begins.,"Apply issue-admission test and decide whether to develop, merge, or retain as research inventory.",2026-06-27.1,current-fixed-status,"Fixed zero-status score is current while the issue remains candidate, retired, merged, pending controlling finding, or otherwise undeveloped.",N/A,N/A,Not scored while issue has fixed zero-status or is not developed.,N/A,N/A,N/A,N/A,Not assessed while issue has fixed zero-status or is not developed.
PAR-006,A-05,Bypass of professional clemency review,Candidate,1,0,Pending development; no proposal-quality score assigned,Initial framework and inventory audit,2026-06-24,Issue is identified in inventory but has not yet been developed into a basic proposal framework; no proposal-quality score is assigned until development begins.,"Apply issue-admission test and decide whether to develop, merge, or retain as research inventory.",2026-06-27.1,current-fixed-status,"Fixed zero-status score is current while the issue remains candidate, retired, merged, pending controlling finding, or otherwise undeveloped.",N/A,N/A,Not scored while issue has fixed zero-status or is not developed.,N/A,N/A,N/A,N/A,Not assessed while issue has fixed zero-status or is not developed.
PAR-007,A-05,Inadequate transparency,Candidate,1,0,Pending development; no proposal-quality score assigned,Initial framework and inventory audit,2026-06-24,Issue is identified in inventory but has not yet been developed into a basic proposal framework; no proposal-quality score is assigned until development begins.,"Apply issue-admission test and decide whether to develop, merge, or retain as research inventory.",2026-06-27.1,current-fixed-status,"Fixed zero-status score is current while the issue remains candidate, retired, merged, pending controlling finding, or otherwise undeveloped.",N/A,N/A,Not scored while issue has fixed zero-status or is not developed.,N/A,N/A,N/A,N/A,Not assessed while issue has fixed zero-status or is not developed.
PAR-008,A-05,Blanket or categorical pardons,Candidate,1,0,Pending development; no proposal-quality score assigned,Initial framework and inventory audit,2026-06-24,Issue is identified in inventory but has not yet been developed into a basic proposal framework; no proposal-quality score is assigned until development begins.,"Apply issue-admission test and decide whether to develop, merge, or retain as research inventory.",2026-06-27.1,current-fixed-status,"Fixed zero-status score is current while the issue remains candidate, retired, merged, pending controlling finding, or otherwise undeveloped.",N/A,N/A,Not scored while issue has fixed zero-status or is not developed.,N/A,N/A,N/A,N/A,Not assessed while issue has fixed zero-status or is not developed.
PAR-009,A-05,Transition-period pardons,Candidate,1,0,Pending development; no proposal-quality score assigned,Initial framework and inventory audit,2026-06-24,Issue is identified in inventory but has not yet been developed into a basic proposal framework; no proposal-quality score is assigned until development begins.,"Apply issue-admission test and decide whether to develop, merge, or retain as research inventory.",2026-06-27.1,current-fixed-status,"Fixed zero-status score is current while the issue remains candidate, retired, merged, pending controlling finding, or otherwise undeveloped.",N/A,N/A,Not scored while issue has fixed zero-status or is not developed.,N/A,N/A,N/A,N/A,Not assessed while issue has fixed zero-status or is not developed.
PAR-010,A-05,Weak remedies after corrupt use,Candidate,1,0,Pending development; no proposal-quality score assigned,Initial framework and inventory audit,2026-06-24,Issue is identified in inventory but has not yet been developed into a basic proposal framework; no proposal-quality score is assigned until development begins.,"Apply issue-admission test and decide whether to develop, merge, or retain as research inventory.",2026-06-27.1,current-fixed-status,"Fixed zero-status score is current while the issue remains candidate, retired, merged, pending controlling finding, or otherwise undeveloped.",N/A,N/A,Not scored while issue has fixed zero-status or is not developed.,N/A,N/A,N/A,N/A,Not assessed while issue has fixed zero-status or is not developed.
EMOL-001,A-06,Lack of mandatory divestment,Candidate,1,0,Pending development; no proposal-quality score assigned,Initial framework and inventory audit,2026-06-24,Issue is identified in inventory but has not yet been developed into a basic proposal framework; no proposal-quality score is assigned until development begins.,"Apply issue-admission test and decide whether to develop, merge, or retain as research inventory.",2026-06-27.1,current-fixed-status,"Fixed zero-status score is current while the issue remains candidate, retired, merged, pending controlling finding, or otherwise undeveloped.",N/A,N/A,Not scored while issue has fixed zero-status or is not developed.,N/A,N/A,N/A,N/A,Not assessed while issue has fixed zero-status or is not developed.
EMOL-002,A-06,Presidential exemption from ordinary conflict-of-interest law,Candidate,1,0,Pending development; no proposal-quality score assigned,Initial framework and inventory audit,2026-06-24,Issue is identified in inventory but has not yet been developed into a basic proposal framework; no proposal-quality score is assigned until development begins.,"Apply issue-admission test and decide whether to develop, merge, or retain as research inventory.",2026-06-27.1,current-fixed-status,"Fixed zero-status score is current while the issue remains candidate, retired, merged, pending controlling finding, or otherwise undeveloped.",N/A,N/A,Not scored while issue has fixed zero-status or is not developed.,N/A,N/A,N/A,N/A,Not assessed while issue has fixed zero-status or is not developed.
EMOL-003,A-06,Absence of a designated enforcement institution,Candidate,1,0,Pending development; no proposal-quality score assigned,Initial framework and inventory audit,2026-06-24,Issue is identified in inventory but has not yet been developed into a basic proposal framework; no proposal-quality score is assigned until development begins.,"Apply issue-admission test and decide whether to develop, merge, or retain as research inventory.",2026-06-27.1,current-fixed-status,"Fixed zero-status score is current while the issue remains candidate, retired, merged, pending controlling finding, or otherwise undeveloped.",N/A,N/A,Not scored while issue has fixed zero-status or is not developed.,N/A,N/A,N/A,N/A,Not assessed while issue has fixed zero-status or is not developed.
EMOL-004,A-06,Standing barriers,Candidate,1,0,Pending development; no proposal-quality score assigned,Initial framework and inventory audit,2026-06-24,Issue is identified in inventory but has not yet been developed into a basic proposal framework; no proposal-quality score is assigned until development begins.,"Apply issue-admission test and decide whether to develop, merge, or retain as research inventory.",2026-06-27.1,current-fixed-status,"Fixed zero-status score is current while the issue remains candidate, retired, merged, pending controlling finding, or otherwise undeveloped.",N/A,N/A,Not scored while issue has fixed zero-status or is not developed.,N/A,N/A,N/A,N/A,Not assessed while issue has fixed zero-status or is not developed.
EMOL-005,A-06,Uncertainty over the meaning of emolument,Candidate,1,0,Pending development; no proposal-quality score assigned,Initial framework and inventory audit,2026-06-24,Issue is identified in inventory but has not yet been developed into a basic proposal framework; no proposal-quality score is assigned until development begins.,"Apply issue-admission test and decide whether to develop, merge, or retain as research inventory.",2026-06-27.1,current-fixed-status,"Fixed zero-status score is current while the issue remains candidate, retired, merged, pending controlling finding, or otherwise undeveloped.",N/A,N/A,Not scored while issue has fixed zero-status or is not developed.,N/A,N/A,N/A,N/A,Not assessed while issue has fixed zero-status or is not developed.
EMOL-006,A-06,Benefits routed through business entities,Candidate,1,0,Pending development; no proposal-quality score assigned,Initial framework and inventory audit,2026-06-24,Issue is identified in inventory but has not yet been developed into a basic proposal framework; no proposal-quality score is assigned until development begins.,"Apply issue-admission test and decide whether to develop, merge, or retain as research inventory.",2026-06-27.1,current-fixed-status,"Fixed zero-status score is current while the issue remains candidate, retired, merged, pending controlling finding, or otherwise undeveloped.",N/A,N/A,Not scored while issue has fixed zero-status or is not developed.,N/A,N/A,N/A,N/A,Not assessed while issue has fixed zero-status or is not developed.
EMOL-007,A-06,Foreign-government patronage,Candidate,1,0,Pending development; no proposal-quality score assigned,Initial framework and inventory audit,2026-06-24,Issue is identified in inventory but has not yet been developed into a basic proposal framework; no proposal-quality score is assigned until development begins.,"Apply issue-admission test and decide whether to develop, merge, or retain as research inventory.",2026-06-27.1,current-fixed-status,"Fixed zero-status score is current while the issue remains candidate, retired, merged, pending controlling finding, or otherwise undeveloped.",N/A,N/A,Not scored while issue has fixed zero-status or is not developed.,N/A,N/A,N/A,N/A,Not assessed while issue has fixed zero-status or is not developed.
EMOL-008,A-06,Domestic-government spending at presidential businesses,Candidate,1,0,Pending development; no proposal-quality score assigned,Initial framework and inventory audit,2026-06-24,Issue is identified in inventory but has not yet been developed into a basic proposal framework; no proposal-quality score is assigned until development begins.,"Apply issue-admission test and decide whether to develop, merge, or retain as research inventory.",2026-06-27.1,current-fixed-status,"Fixed zero-status score is current while the issue remains candidate, retired, merged, pending controlling finding, or otherwise undeveloped.",N/A,N/A,Not scored while issue has fixed zero-status or is not developed.,N/A,N/A,N/A,N/A,Not assessed while issue has fixed zero-status or is not developed.
EMOL-009,A-06,Inadequate financial disclosure,Candidate,1,0,Pending development; no proposal-quality score assigned,Initial framework and inventory audit,2026-06-24,Issue is identified in inventory but has not yet been developed into a basic proposal framework; no proposal-quality score is assigned until development begins.,"Apply issue-admission test and decide whether to develop, merge, or retain as research inventory.",2026-06-27.1,current-fixed-status,"Fixed zero-status score is current while the issue remains candidate, retired, merged, pending controlling finding, or otherwise undeveloped.",N/A,N/A,Not scored while issue has fixed zero-status or is not developed.,N/A,N/A,N/A,N/A,Not assessed while issue has fixed zero-status or is not developed.
EMOL-010,A-06,Lack of an operational congressional-consent process,Candidate,1,0,Pending development; no proposal-quality score assigned,Initial framework and inventory audit,2026-06-24,Issue is identified in inventory but has not yet been developed into a basic proposal framework; no proposal-quality score is assigned until development begins.,"Apply issue-admission test and decide whether to develop, merge, or retain as research inventory.",2026-06-27.1,current-fixed-status,"Fixed zero-status score is current while the issue remains candidate, retired, merged, pending controlling finding, or otherwise undeveloped.",N/A,N/A,Not scored while issue has fixed zero-status or is not developed.,N/A,N/A,N/A,N/A,Not assessed while issue has fixed zero-status or is not developed.
EMOL-011,A-06,Remedies that arrive too late,Candidate,1,0,Pending development; no proposal-quality score assigned,Initial framework and inventory audit,2026-06-24,Issue is identified in inventory but has not yet been developed into a basic proposal framework; no proposal-quality score is assigned until development begins.,"Apply issue-admission test and decide whether to develop, merge, or retain as research inventory.",2026-06-27.1,current-fixed-status,"Fixed zero-status score is current while the issue remains candidate, retired, merged, pending controlling finding, or otherwise undeveloped.",N/A,N/A,Not scored while issue has fixed zero-status or is not developed.,N/A,N/A,N/A,N/A,Not assessed while issue has fixed zero-status or is not developed.
EMOL-012,A-06,Lack of effective disgorgement,Candidate,1,0,Pending development; no proposal-quality score assigned,Initial framework and inventory audit,2026-06-24,Issue is identified in inventory but has not yet been developed into a basic proposal framework; no proposal-quality score is assigned until development begins.,"Apply issue-admission test and decide whether to develop, merge, or retain as research inventory.",2026-06-27.1,current-fixed-status,"Fixed zero-status score is current while the issue remains candidate, retired, merged, pending controlling finding, or otherwise undeveloped.",N/A,N/A,Not scored while issue has fixed zero-status or is not developed.,N/A,N/A,N/A,N/A,Not assessed while issue has fixed zero-status or is not developed.
EMOL-013,A-06,Circumvention through family or affiliated entities,Candidate,1,0,Pending development; no proposal-quality score assigned,Initial framework and inventory audit,2026-06-24,Issue is identified in inventory but has not yet been developed into a basic proposal framework; no proposal-quality score is assigned until development begins.,"Apply issue-admission test and decide whether to develop, merge, or retain as research inventory.",2026-06-27.1,current-fixed-status,"Fixed zero-status score is current while the issue remains candidate, retired, merged, pending controlling finding, or otherwise undeveloped.",N/A,N/A,Not scored while issue has fixed zero-status or is not developed.,N/A,N/A,N/A,N/A,Not assessed while issue has fixed zero-status or is not developed.
EMOL-014,A-06,Dependence on impeachment or political restraint,Candidate,1,0,Pending development; no proposal-quality score assigned,Initial framework and inventory audit,2026-06-24,Issue is identified in inventory but has not yet been developed into a basic proposal framework; no proposal-quality score is assigned until development begins.,"Apply issue-admission test and decide whether to develop, merge, or retain as research inventory.",2026-06-27.1,current-fixed-status,"Fixed zero-status score is current while the issue remains candidate, retired, merged, pending controlling finding, or otherwise undeveloped.",N/A,N/A,Not scored while issue has fixed zero-status or is not developed.,N/A,N/A,N/A,N/A,Not assessed while issue has fixed zero-status or is not developed.
CLASS-001,A-07,Undocumented presidential declassification,Candidate,1,0,Pending development; no proposal-quality score assigned,Initial framework and inventory audit,2026-06-24,Issue is identified in inventory but has not yet been developed into a basic proposal framework; no proposal-quality score is assigned until development begins.,"Apply issue-admission test and decide whether to develop, merge, or retain as research inventory.",2026-06-27.1,current-fixed-status,"Fixed zero-status score is current while the issue remains candidate, retired, merged, pending controlling finding, or otherwise undeveloped.",N/A,N/A,Not scored while issue has fixed zero-status or is not developed.,N/A,N/A,N/A,N/A,Not assessed while issue has fixed zero-status or is not developed.
CLASS-002,A-07,Confusion between declassification and lawful possession,Candidate,1,0,Pending development; no proposal-quality score assigned,Initial framework and inventory audit,2026-06-24,Issue is identified in inventory but has not yet been developed into a basic proposal framework; no proposal-quality score is assigned until development begins.,"Apply issue-admission test and decide whether to develop, merge, or retain as research inventory.",2026-06-27.1,current-fixed-status,"Fixed zero-status score is current while the issue remains candidate, retired, merged, pending controlling finding, or otherwise undeveloped.",N/A,N/A,Not scored while issue has fixed zero-status or is not developed.,N/A,N/A,N/A,N/A,Not assessed while issue has fixed zero-status or is not developed.
CLASS-003,A-07,Unclear statutory exceptions such as Restricted Data,Candidate,1,0,Pending development; no proposal-quality score assigned,Initial framework and inventory audit,2026-06-24,Issue is identified in inventory but has not yet been developed into a basic proposal framework; no proposal-quality score is assigned until development begins.,"Apply issue-admission test and decide whether to develop, merge, or retain as research inventory.",2026-06-27.1,current-fixed-status,"Fixed zero-status score is current while the issue remains candidate, retired, merged, pending controlling finding, or otherwise undeveloped.",N/A,N/A,Not scored while issue has fixed zero-status or is not developed.,N/A,N/A,N/A,N/A,Not assessed while issue has fixed zero-status or is not developed.
CLASS-004,A-07,Classification used to conceal misconduct or embarrassment,Candidate,1,0,Pending development; no proposal-quality score assigned,Initial framework and inventory audit,2026-06-24,Issue is identified in inventory but has not yet been developed into a basic proposal framework; no proposal-quality score is assigned until development begins.,"Apply issue-admission test and decide whether to develop, merge, or retain as research inventory.",2026-06-27.1,current-fixed-status,"Fixed zero-status score is current while the issue remains candidate, retired, merged, pending controlling finding, or otherwise undeveloped.",N/A,N/A,Not scored while issue has fixed zero-status or is not developed.,N/A,N/A,N/A,N/A,Not assessed while issue has fixed zero-status or is not developed.
CLASS-005,A-07,Politically selective declassification,Candidate,1,0,Pending development; no proposal-quality score assigned,Initial framework and inventory audit,2026-06-24,Issue is identified in inventory but has not yet been developed into a basic proposal framework; no proposal-quality score is assigned until development begins.,"Apply issue-admission test and decide whether to develop, merge, or retain as research inventory.",2026-06-27.1,current-fixed-status,"Fixed zero-status score is current while the issue remains candidate, retired, merged, pending controlling finding, or otherwise undeveloped.",N/A,N/A,Not scored while issue has fixed zero-status or is not developed.,N/A,N/A,N/A,N/A,Not assessed while issue has fixed zero-status or is not developed.
CLASS-006,A-07,Inadequate protection against exposure of intelligence sources and methods,Candidate,1,0,Pending development; no proposal-quality score assigned,Initial framework and inventory audit,2026-06-24,Issue is identified in inventory but has not yet been developed into a basic proposal framework; no proposal-quality score is assigned until development begins.,"Apply issue-admission test and decide whether to develop, merge, or retain as research inventory.",2026-06-27.1,current-fixed-status,"Fixed zero-status score is current while the issue remains candidate, retired, merged, pending controlling finding, or otherwise undeveloped.",N/A,N/A,Not scored while issue has fixed zero-status or is not developed.,N/A,N/A,N/A,N/A,Not assessed while issue has fixed zero-status or is not developed.
CLASS-007,A-07,Weak archival and agency implementation procedures,Candidate,1,0,Pending development; no proposal-quality score assigned,Initial framework and inventory audit,2026-06-24,Issue is identified in inventory but has not yet been developed into a basic proposal framework; no proposal-quality score is assigned until development begins.,"Apply issue-admission test and decide whether to develop, merge, or retain as research inventory.",2026-06-27.1,current-fixed-status,"Fixed zero-status score is current while the issue remains candidate, retired, merged, pending controlling finding, or otherwise undeveloped.",N/A,N/A,Not scored while issue has fixed zero-status or is not developed.,N/A,N/A,N/A,N/A,Not assessed while issue has fixed zero-status or is not developed.
CLASS-008,A-07,Overclassification and excessive secrecy,Candidate,1,0,Pending development; no proposal-quality score assigned,Initial framework and inventory audit,2026-06-24,Issue is identified in inventory but has not yet been developed into a basic proposal framework; no proposal-quality score is assigned until development begins.,"Apply issue-admission test and decide whether to develop, merge, or retain as research inventory.",2026-06-27.1,current-fixed-status,"Fixed zero-status score is current while the issue remains candidate, retired, merged, pending controlling finding, or otherwise undeveloped.",N/A,N/A,Not scored while issue has fixed zero-status or is not developed.,N/A,N/A,N/A,N/A,Not assessed while issue has fixed zero-status or is not developed.
CLASS-009,A-07,Insufficient congressional access and oversight,Candidate,1,0,Pending development; no proposal-quality score assigned,Initial framework and inventory audit,2026-06-24,Issue is identified in inventory but has not yet been developed into a basic proposal framework; no proposal-quality score is assigned until development begins.,"Apply issue-admission test and decide whether to develop, merge, or retain as research inventory.",2026-06-27.1,current-fixed-status,"Fixed zero-status score is current while the issue remains candidate, retired, merged, pending controlling finding, or otherwise undeveloped.",N/A,N/A,Not scored while issue has fixed zero-status or is not developed.,N/A,N/A,N/A,N/A,Not assessed while issue has fixed zero-status or is not developed.
CLASS-010,A-07,Limited external review and judicial remedies,Candidate,1,0,Pending development; no proposal-quality score assigned,Initial framework and inventory audit,2026-06-24,Issue is identified in inventory but has not yet been developed into a basic proposal framework; no proposal-quality score is assigned until development begins.,"Apply issue-admission test and decide whether to develop, merge, or retain as research inventory.",2026-06-27.1,current-fixed-status,"Fixed zero-status score is current while the issue remains candidate, retired, merged, pending controlling finding, or otherwise undeveloped.",N/A,N/A,Not scored while issue has fixed zero-status or is not developed.,N/A,N/A,N/A,N/A,Not assessed while issue has fixed zero-status or is not developed.
