Issue ID,Area ID,Title,Development Status,Audit Runs,Proposal Quality Score,Audit Status,Last Audit Type,Last Audit Date,Score Basis,Next Audit Need,Audit Rubric Version,Rebaseline Status,Rebaseline Notes,Adoption Friction Score,Adoption Friction Band,Adoption Friction Notes,Required Electoral Environment,Pathway Viability,Development Priority,Pathway Adjustment,Enactment Pathway Notes
CONG-005,A-15,Contempt referrals dependent on DOJ,Candidate,1,0,Pending development; no proposal-quality score assigned,Initial framework and inventory audit,2026-06-24,Issue is identified in inventory but has not yet been developed into a basic proposal framework; no proposal-quality score is assigned until development begins.,"Apply issue-admission test and decide whether to develop, merge, or retain as research inventory.",2026-06-27.1,current-fixed-status,"Fixed zero-status score is current while the issue remains candidate, retired, merged, pending controlling finding, or otherwise undeveloped.",N/A,N/A,Not scored while issue has fixed zero-status or is not developed.,N/A,N/A,N/A,N/A,Not assessed while issue has fixed zero-status or is not developed.
CONG-006,A-15,Lack of expedited judicial review,Candidate,1,0,Pending development; no proposal-quality score assigned,Initial framework and inventory audit,2026-06-24,Issue is identified in inventory but has not yet been developed into a basic proposal framework; no proposal-quality score is assigned until development begins.,"Apply issue-admission test and decide whether to develop, merge, or retain as research inventory.",2026-06-27.1,current-fixed-status,"Fixed zero-status score is current while the issue remains candidate, retired, merged, pending controlling finding, or otherwise undeveloped.",N/A,N/A,Not scored while issue has fixed zero-status or is not developed.,N/A,N/A,N/A,N/A,Not assessed while issue has fixed zero-status or is not developed.
CONG-007,A-15,Weak committee investigative capacity,Candidate,1,0,Pending development; no proposal-quality score assigned,Initial framework and inventory audit,2026-06-24,Issue is identified in inventory but has not yet been developed into a basic proposal framework; no proposal-quality score is assigned until development begins.,"Apply issue-admission test and decide whether to develop, merge, or retain as research inventory.",2026-06-27.1,current-fixed-status,"Fixed zero-status score is current while the issue remains candidate, retired, merged, pending controlling finding, or otherwise undeveloped.",N/A,N/A,Not scored while issue has fixed zero-status or is not developed.,N/A,N/A,N/A,N/A,Not assessed while issue has fixed zero-status or is not developed.
CONG-008,A-15,Partisan collapse of oversight under unified government,Candidate,1,0,Pending development; no proposal-quality score assigned,Initial framework and inventory audit,2026-06-24,Issue is identified in inventory but has not yet been developed into a basic proposal framework; no proposal-quality score is assigned until development begins.,"Apply issue-admission test and decide whether to develop, merge, or retain as research inventory.",2026-06-27.1,current-fixed-status,"Fixed zero-status score is current while the issue remains candidate, retired, merged, pending controlling finding, or otherwise undeveloped.",N/A,N/A,Not scored while issue has fixed zero-status or is not developed.,N/A,N/A,N/A,N/A,Not assessed while issue has fixed zero-status or is not developed.
IMM-001,A-16,Criminal Immunity for Presidential Official Acts,Developed,1,60,Structural audit complete; advanced audits pending,Initial framework and inventory audit,2026-06-24,"Issue has a developed page and linked legislation path, and has passed current structural inventory review; source, legal-fit, prior-proposal, and adoption audits remain incomplete.","Complete source verification, existing-law fit, prior-proposal survey, political-language neutrality, coalition-appeal, and implementation-risk audits.",pre-2026-06-27.1,hard-rebaseline-needed,Developed proposal score predates explicit rubric-version tracking or full component rebaseline; recalculate under current rubric during the next T2/T3/T4 audit. Adoption friction also remains unassessed under rubric 2026-06-26.2. Rubric 2026-06-27.1 added a required evidence-bound T1 Enactment Pathway Check that can affect Adoption and Implementation scoring.,,Unassessed,Adoption friction companion metric added in rubric 2026-06-26.2; assign during the next substantive audit rather than inferring retroactively.,unassessed,unassessed,unassessed,unassessed,"Required T1 enactment-pathway check added in rubric 2026-06-27.1; assess using sourced electoral, legislative, polling, historical, judicial, and institutional evidence during the next substantive audit."
IMM-002,A-16,Civil immunity and remedial gaps,Candidate,1,0,Pending development; no proposal-quality score assigned,Initial framework and inventory audit,2026-06-24,Issue is identified in inventory but has not yet been developed into a basic proposal framework; no proposal-quality score is assigned until development begins.,"Apply issue-admission test and decide whether to develop, merge, or retain as research inventory.",2026-06-27.1,current-fixed-status,"Fixed zero-status score is current while the issue remains candidate, retired, merged, pending controlling finding, or otherwise undeveloped.",N/A,N/A,Not scored while issue has fixed zero-status or is not developed.,N/A,N/A,N/A,N/A,Not assessed while issue has fixed zero-status or is not developed.
IMM-003,A-16,Statutes of limitation during presidential tenure,Candidate,1,0,Pending development; no proposal-quality score assigned,Initial framework and inventory audit,2026-06-24,Issue is identified in inventory but has not yet been developed into a basic proposal framework; no proposal-quality score is assigned until development begins.,"Apply issue-admission test and decide whether to develop, merge, or retain as research inventory.",2026-06-27.1,current-fixed-status,"Fixed zero-status score is current while the issue remains candidate, retired, merged, pending controlling finding, or otherwise undeveloped.",N/A,N/A,Not scored while issue has fixed zero-status or is not developed.,N/A,N/A,N/A,N/A,Not assessed while issue has fixed zero-status or is not developed.
IMM-004,A-16,Restrictions on evidentiary use of official conduct,Candidate,1,0,Pending development; no proposal-quality score assigned,Initial framework and inventory audit,2026-06-24,Issue is identified in inventory but has not yet been developed into a basic proposal framework; no proposal-quality score is assigned until development begins.,"Apply issue-admission test and decide whether to develop, merge, or retain as research inventory.",2026-06-27.1,current-fixed-status,"Fixed zero-status score is current while the issue remains candidate, retired, merged, pending controlling finding, or otherwise undeveloped.",N/A,N/A,Not scored while issue has fixed zero-status or is not developed.,N/A,N/A,N/A,N/A,Not assessed while issue has fixed zero-status or is not developed.
IMM-005,A-16,Delay as de facto immunity,Candidate,1,0,Pending development; no proposal-quality score assigned,Initial framework and inventory audit,2026-06-24,Issue is identified in inventory but has not yet been developed into a basic proposal framework; no proposal-quality score is assigned until development begins.,"Apply issue-admission test and decide whether to develop, merge, or retain as research inventory.",2026-06-27.1,current-fixed-status,"Fixed zero-status score is current while the issue remains candidate, retired, merged, pending controlling finding, or otherwise undeveloped.",N/A,N/A,Not scored while issue has fixed zero-status or is not developed.,N/A,N/A,N/A,N/A,Not assessed while issue has fixed zero-status or is not developed.
IMM-006,A-16,Relationship between impeachment and criminal liability,Candidate,1,0,Pending development; no proposal-quality score assigned,Initial framework and inventory audit,2026-06-24,Issue is identified in inventory but has not yet been developed into a basic proposal framework; no proposal-quality score is assigned until development begins.,"Apply issue-admission test and decide whether to develop, merge, or retain as research inventory.",2026-06-27.1,current-fixed-status,"Fixed zero-status score is current while the issue remains candidate, retired, merged, pending controlling finding, or otherwise undeveloped.",N/A,N/A,Not scored while issue has fixed zero-status or is not developed.,N/A,N/A,N/A,N/A,Not assessed while issue has fixed zero-status or is not developed.
IMM-007,A-16,Self-protective use of presidential powers,Candidate,1,0,Pending development; no proposal-quality score assigned,Initial framework and inventory audit,2026-06-24,Issue is identified in inventory but has not yet been developed into a basic proposal framework; no proposal-quality score is assigned until development begins.,"Apply issue-admission test and decide whether to develop, merge, or retain as research inventory.",2026-06-27.1,current-fixed-status,"Fixed zero-status score is current while the issue remains candidate, retired, merged, pending controlling finding, or otherwise undeveloped.",N/A,N/A,Not scored while issue has fixed zero-status or is not developed.,N/A,N/A,N/A,N/A,Not assessed while issue has fixed zero-status or is not developed.
IMM-008,A-16,Independent investigation and prosecution mechanisms,Candidate,1,0,Pending development; no proposal-quality score assigned,Initial framework and inventory audit,2026-06-24,Issue is identified in inventory but has not yet been developed into a basic proposal framework; no proposal-quality score is assigned until development begins.,"Apply issue-admission test and decide whether to develop, merge, or retain as research inventory.",2026-06-27.1,current-fixed-status,"Fixed zero-status score is current while the issue remains candidate, retired, merged, pending controlling finding, or otherwise undeveloped.",N/A,N/A,Not scored while issue has fixed zero-status or is not developed.,N/A,N/A,N/A,N/A,Not assessed while issue has fixed zero-status or is not developed.
REG-001,A-17,Erosion of removal protections,Candidate,1,0,Pending development; no proposal-quality score assigned,Initial framework and inventory audit,2026-06-24,Issue is identified in inventory but has not yet been developed into a basic proposal framework; no proposal-quality score is assigned until development begins.,"Apply issue-admission test and decide whether to develop, merge, or retain as research inventory.",2026-06-27.1,current-fixed-status,"Fixed zero-status score is current while the issue remains candidate, retired, merged, pending controlling finding, or otherwise undeveloped.",N/A,N/A,Not scored while issue has fixed zero-status or is not developed.,N/A,N/A,N/A,N/A,Not assessed while issue has fixed zero-status or is not developed.
REG-002,A-17,Politicized enforcement or nonenforcement,Candidate,1,0,Pending development; no proposal-quality score assigned,Initial framework and inventory audit,2026-06-24,Issue is identified in inventory but has not yet been developed into a basic proposal framework; no proposal-quality score is assigned until development begins.,"Apply issue-admission test and decide whether to develop, merge, or retain as research inventory.",2026-06-27.1,current-fixed-status,"Fixed zero-status score is current while the issue remains candidate, retired, merged, pending controlling finding, or otherwise undeveloped.",N/A,N/A,Not scored while issue has fixed zero-status or is not developed.,N/A,N/A,N/A,N/A,Not assessed while issue has fixed zero-status or is not developed.
REG-003,A-17,Control of administrative adjudication,Candidate,1,0,Pending development; no proposal-quality score assigned,Initial framework and inventory audit,2026-06-24,Issue is identified in inventory but has not yet been developed into a basic proposal framework; no proposal-quality score is assigned until development begins.,"Apply issue-admission test and decide whether to develop, merge, or retain as research inventory.",2026-06-27.1,current-fixed-status,"Fixed zero-status score is current while the issue remains candidate, retired, merged, pending controlling finding, or otherwise undeveloped.",N/A,N/A,Not scored while issue has fixed zero-status or is not developed.,N/A,N/A,N/A,N/A,Not assessed while issue has fixed zero-status or is not developed.
REG-004,A-17,Suspension or dismantling of agency operations,Candidate,1,0,Pending development; no proposal-quality score assigned,Initial framework and inventory audit,2026-06-24,Issue is identified in inventory but has not yet been developed into a basic proposal framework; no proposal-quality score is assigned until development begins.,"Apply issue-admission test and decide whether to develop, merge, or retain as research inventory.",2026-06-27.1,current-fixed-status,"Fixed zero-status score is current while the issue remains candidate, retired, merged, pending controlling finding, or otherwise undeveloped.",N/A,N/A,Not scored while issue has fixed zero-status or is not developed.,N/A,N/A,N/A,N/A,Not assessed while issue has fixed zero-status or is not developed.
REG-005,A-17,Manipulation of commissions through vacancies,Candidate,1,0,Pending development; no proposal-quality score assigned,Initial framework and inventory audit,2026-06-24,Issue is identified in inventory but has not yet been developed into a basic proposal framework; no proposal-quality score is assigned until development begins.,"Apply issue-admission test and decide whether to develop, merge, or retain as research inventory.",2026-06-27.1,current-fixed-status,"Fixed zero-status score is current while the issue remains candidate, retired, merged, pending controlling finding, or otherwise undeveloped.",N/A,N/A,Not scored while issue has fixed zero-status or is not developed.,N/A,N/A,N/A,N/A,Not assessed while issue has fixed zero-status or is not developed.
REG-006,A-17,Presidential control of rulemaking and legal positions,Candidate,1,0,Pending development; no proposal-quality score assigned,Initial framework and inventory audit,2026-06-24,Issue is identified in inventory but has not yet been developed into a basic proposal framework; no proposal-quality score is assigned until development begins.,"Apply issue-admission test and decide whether to develop, merge, or retain as research inventory.",2026-06-27.1,current-fixed-status,"Fixed zero-status score is current while the issue remains candidate, retired, merged, pending controlling finding, or otherwise undeveloped.",N/A,N/A,Not scored while issue has fixed zero-status or is not developed.,N/A,N/A,N/A,N/A,Not assessed while issue has fixed zero-status or is not developed.
REG-007,A-17,Threats to independent funding,Candidate,1,0,Pending development; no proposal-quality score assigned,Initial framework and inventory audit,2026-06-24,Issue is identified in inventory but has not yet been developed into a basic proposal framework; no proposal-quality score is assigned until development begins.,"Apply issue-admission test and decide whether to develop, merge, or retain as research inventory.",2026-06-27.1,current-fixed-status,"Fixed zero-status score is current while the issue remains candidate, retired, merged, pending controlling finding, or otherwise undeveloped.",N/A,N/A,Not scored while issue has fixed zero-status or is not developed.,N/A,N/A,N/A,N/A,Not assessed while issue has fixed zero-status or is not developed.
REG-008,A-17,Unclear constitutional design options after recent doctrine,Candidate,1,0,Pending development; no proposal-quality score assigned,Initial framework and inventory audit,2026-06-24,Issue is identified in inventory but has not yet been developed into a basic proposal framework; no proposal-quality score is assigned until development begins.,"Apply issue-admission test and decide whether to develop, merge, or retain as research inventory.",2026-06-27.1,current-fixed-status,"Fixed zero-status score is current while the issue remains candidate, retired, merged, pending controlling finding, or otherwise undeveloped.",N/A,N/A,Not scored while issue has fixed zero-status or is not developed.,N/A,N/A,N/A,N/A,Not assessed while issue has fixed zero-status or is not developed.
FACT-001,A-18,Political review or alteration of scientific reports,Candidate,1,0,Pending development; no proposal-quality score assigned,Initial framework and inventory audit,2026-06-24,Issue is identified in inventory but has not yet been developed into a basic proposal framework; no proposal-quality score is assigned until development begins.,"Apply issue-admission test and decide whether to develop, merge, or retain as research inventory.",2026-06-27.1,current-fixed-status,"Fixed zero-status score is current while the issue remains candidate, retired, merged, pending controlling finding, or otherwise undeveloped.",N/A,N/A,Not scored while issue has fixed zero-status or is not developed.,N/A,N/A,N/A,N/A,Not assessed while issue has fixed zero-status or is not developed.
FACT-002,A-18,Removal or suppression of datasets,Candidate,1,0,Pending development; no proposal-quality score assigned,Initial framework and inventory audit,2026-06-24,Issue is identified in inventory but has not yet been developed into a basic proposal framework; no proposal-quality score is assigned until development begins.,"Apply issue-admission test and decide whether to develop, merge, or retain as research inventory.",2026-06-27.1,current-fixed-status,"Fixed zero-status score is current while the issue remains candidate, retired, merged, pending controlling finding, or otherwise undeveloped.",N/A,N/A,Not scored while issue has fixed zero-status or is not developed.,N/A,N/A,N/A,N/A,Not assessed while issue has fixed zero-status or is not developed.
FACT-003,A-18,Manipulation of publication schedules,Candidate,1,0,Pending development; no proposal-quality score assigned,Initial framework and inventory audit,2026-06-24,Issue is identified in inventory but has not yet been developed into a basic proposal framework; no proposal-quality score is assigned until development begins.,"Apply issue-admission test and decide whether to develop, merge, or retain as research inventory.",2026-06-27.1,current-fixed-status,"Fixed zero-status score is current while the issue remains candidate, retired, merged, pending controlling finding, or otherwise undeveloped.",N/A,N/A,Not scored while issue has fixed zero-status or is not developed.,N/A,N/A,N/A,N/A,Not assessed while issue has fixed zero-status or is not developed.
FACT-004,A-18,Interference with statistical agencies,Candidate,1,0,Pending development; no proposal-quality score assigned,Initial framework and inventory audit,2026-06-24,Issue is identified in inventory but has not yet been developed into a basic proposal framework; no proposal-quality score is assigned until development begins.,"Apply issue-admission test and decide whether to develop, merge, or retain as research inventory.",2026-06-27.1,current-fixed-status,"Fixed zero-status score is current while the issue remains candidate, retired, merged, pending controlling finding, or otherwise undeveloped.",N/A,N/A,Not scored while issue has fixed zero-status or is not developed.,N/A,N/A,N/A,N/A,Not assessed while issue has fixed zero-status or is not developed.
FACT-005,A-18,Censorship of agency terminology,Candidate,1,0,Pending development; no proposal-quality score assigned,Initial framework and inventory audit,2026-06-24,Issue is identified in inventory but has not yet been developed into a basic proposal framework; no proposal-quality score is assigned until development begins.,"Apply issue-admission test and decide whether to develop, merge, or retain as research inventory.",2026-06-27.1,current-fixed-status,"Fixed zero-status score is current while the issue remains candidate, retired, merged, pending controlling finding, or otherwise undeveloped.",N/A,N/A,Not scored while issue has fixed zero-status or is not developed.,N/A,N/A,N/A,N/A,Not assessed while issue has fixed zero-status or is not developed.
FACT-006,A-18,Suppression of unfavorable findings,Candidate,1,0,Pending development; no proposal-quality score assigned,Initial framework and inventory audit,2026-06-24,Issue is identified in inventory but has not yet been developed into a basic proposal framework; no proposal-quality score is assigned until development begins.,"Apply issue-admission test and decide whether to develop, merge, or retain as research inventory.",2026-06-27.1,current-fixed-status,"Fixed zero-status score is current while the issue remains candidate, retired, merged, pending controlling finding, or otherwise undeveloped.",N/A,N/A,Not scored while issue has fixed zero-status or is not developed.,N/A,N/A,N/A,N/A,Not assessed while issue has fixed zero-status or is not developed.
FACT-007,A-18,Political alteration of historical presentation,Candidate,1,0,Pending development; no proposal-quality score assigned,Initial framework and inventory audit,2026-06-24,Issue is identified in inventory but has not yet been developed into a basic proposal framework; no proposal-quality score is assigned until development begins.,"Apply issue-admission test and decide whether to develop, merge, or retain as research inventory.",2026-06-27.1,current-fixed-status,"Fixed zero-status score is current while the issue remains candidate, retired, merged, pending controlling finding, or otherwise undeveloped.",N/A,N/A,Not scored while issue has fixed zero-status or is not developed.,N/A,N/A,N/A,N/A,Not assessed while issue has fixed zero-status or is not developed.
FACT-008,A-18,Insufficient independent archival preservation and methodology protection,Candidate,1,0,Pending development; no proposal-quality score assigned,Initial framework and inventory audit,2026-06-24,Issue is identified in inventory but has not yet been developed into a basic proposal framework; no proposal-quality score is assigned until development begins.,"Apply issue-admission test and decide whether to develop, merge, or retain as research inventory.",2026-06-27.1,current-fixed-status,"Fixed zero-status score is current while the issue remains candidate, retired, merged, pending controlling finding, or otherwise undeveloped.",N/A,N/A,Not scored while issue has fixed zero-status or is not developed.,N/A,N/A,N/A,N/A,Not assessed while issue has fixed zero-status or is not developed.
FACT-009,A-18,"Misleading official terminology, titles, or institutional labels",Candidate,1,0,Pending development; no proposal-quality score assigned,Horizon integration decision,2026-06-25,HOR-005 admitted as A-18 candidate focused on misleading official terminology and institutional labels; no proposal-quality score is assigned until a basic proposal framework is developed.,"Apply issue-admission test during development; source-develop EO 14347, 10 U.S.C. § 111, public-facing DOD/Department of War usage, appropriations/procurement/records consequences, public-notice effects, and war-powers confusion risk.",2026-06-27.1,current-fixed-status,"Fixed zero-status score is current while the issue remains candidate, retired, merged, pending controlling finding, or otherwise undeveloped.",N/A,N/A,Not scored while issue has fixed zero-status or is not developed.,N/A,N/A,N/A,N/A,Not assessed while issue has fixed zero-status or is not developed.
RET-001,A-19,Politically motivated grant cancellation or withholding,Candidate,1,0,Pending development; no proposal-quality score assigned,Initial framework and inventory audit,2026-06-24,Issue is identified in inventory but has not yet been developed into a basic proposal framework; no proposal-quality score is assigned until development begins.,"Apply issue-admission test and decide whether to develop, merge, or retain as research inventory.",2026-06-27.1,current-fixed-status,"Fixed zero-status score is current while the issue remains candidate, retired, merged, pending controlling finding, or otherwise undeveloped.",N/A,N/A,Not scored while issue has fixed zero-status or is not developed.,N/A,N/A,N/A,N/A,Not assessed while issue has fixed zero-status or is not developed.
RET-002,A-19,Contracting favoritism or retaliation,Candidate,1,0,Pending development; no proposal-quality score assigned,Initial framework and inventory audit,2026-06-24,Issue is identified in inventory but has not yet been developed into a basic proposal framework; no proposal-quality score is assigned until development begins.,"Apply issue-admission test and decide whether to develop, merge, or retain as research inventory.",2026-06-27.1,current-fixed-status,"Fixed zero-status score is current while the issue remains candidate, retired, merged, pending controlling finding, or otherwise undeveloped.",N/A,N/A,Not scored while issue has fixed zero-status or is not developed.,N/A,N/A,N/A,N/A,Not assessed while issue has fixed zero-status or is not developed.
RET-003,A-19,Selective regulatory scrutiny,Candidate,1,0,Pending development; no proposal-quality score assigned,Initial framework and inventory audit,2026-06-24,Issue is identified in inventory but has not yet been developed into a basic proposal framework; no proposal-quality score is assigned until development begins.,"Apply issue-admission test and decide whether to develop, merge, or retain as research inventory.",2026-06-27.1,current-fixed-status,"Fixed zero-status score is current while the issue remains candidate, retired, merged, pending controlling finding, or otherwise undeveloped.",N/A,N/A,Not scored while issue has fixed zero-status or is not developed.,N/A,N/A,N/A,N/A,Not assessed while issue has fixed zero-status or is not developed.
